no,timeline,subtittle,text,H-RVkfXWL4s
259,31:27,yeah everyone could hear them wait the teachers they took the teachers don't tell you guys to sleep like they would,
260,31:32,make rounds and they would light their flashlights and and shine it into the tents seeing if we're sleeping or not,
261,31:42,so like they gave them a couple warnings in the end they just gave up and then so they were like you know or like talking,
262,31:49,like Mad Mad Dog about everything and everyone and everyone else was like,
263,31:55,and then Karma thank everything that her has power in this world they're 10,
264,32:00,collapsed oh yeah karma that's what happens,
265,32:08,gonna hit you man I tell you what amazing thing I'd ever I've ever,
266,32:14,witnessed in my life it was great I mean absolutely glorious they did,
267,32:20,then cause a lot of noise trying to figure out how to read make the chocolate that's fine true I mean to be,
268,32:27,honest I could I could sleep peacefully hearing them struggling outside maybe that's just because I'm [ __ ] up,
269,32:34,yeah that was pretty funny hmm yeah oh I forgot to mention what happened today to,
270,32:40,you guys when I went when I went shopping yeah I was on a I was on the hunt for marshmallows and I went,
271,32:47,searching around different shops and I couldn't find them in some places but eventually I did grab some,
272,32:52,um and then on my way maybe this doesn't seem like like a weird thing but to me,
273,32:58,it was probably the most dangerous thing I'd seen in my entire life so there are these kids riding bikes okay I want you,
274,33:05,to imagine this a bike for a small child um let's say maybe about eight years old,
275,33:10,no not a tricycle uh uh maybe kids first two-wheel bicycle no training wheels,
276,33:16,okay for maybe an eight-year-old child and I want you to imagine a tiny little,
277,33:22,eight-year-old Japanese boy uh writing on said bicycle but,
278,33:28,it's not just him he's not the only one on this little bicycle no no no no there's another,
279,33:33,child that's right there's a there's maybe a six-year-old little boy who I,
280,33:39,assume is his brother and the way that he is sitting on this bicycle is that his brother is in sort of a bear hug,
281,33:46,position around him grasping both the handlebars and pedaling of course but his knees are very far spread apart and,
282,33:52,the little boy the six-year-old is balancing by his two feet and grabbing,
283,33:57,onto the middle bar of the bicycle and they are they are cruising down the,
284,34:03,sidewalk and I was like that is the most dangerous thing I've seen in my entire,
285,34:09,life boys can you please stop I don't know what happened to him I hope they're safe,
286,34:15,in Japan in Japan yeah in Japan I was like is this an anime,
287,34:21,am I watching an anime right now where are the parents I don't know there was a whole gang of other kids on bicycles,
288,34:27,behind him though so maybe they were like a little like mini like like bicycle crew,
289,34:34,yeah we always ride on our bikes like this oh my God this is the anime moment,
290,34:40,where like the policeman comes out of the booth and he's like no time tandem writing is that what they call it,
291,34:47,is that what it is I don't know what it is that what it is is that what it's called what's on your handlebars I,
292,34:54,vaguely remember seeing that as a subtitle in some anime that I watched yeah I mean it would have been much,
293,34:59,cuter if like the the little one was on the handlebars or maybe like on the back of the seat but no that was just the,
294,35:05,most horrifying thing I'd seen that day I mean I was thinking are those kids,
295,35:11,gonna make it are they okay man a little tattoo and Connor,
296,35:19,yeah very cute and then another weird thing happened I you know got my goods I got,
297,35:26,into the house and I just I got the goods and I just sprawled out on the,
298,35:32,couch and I just like started eating a Popsicle played a little played some video games and I was like I don't know,
299,35:37,why but being outside for two seconds has made me extremely tired let me go take a nap so I went to go take a nap,
300,35:42,and I get interrupted like mid nap as I'm straight falling into like the really good part of sleep so I'm super,
301,35:49,crabby right well I get up and I go to the door and I see a very official human being at my door and I'm like oh no I'm,
302,35:57,super scared so I let him at night uh I mean it was like yeah it was a couple a,
303,36:02,couple hours ago but I see a a an individual with a clipboard and [ __ ] so,
304,36:07,I'm like oh man they're coming to get me and I I hadn't paid my I hadn't paid my bills in a little bit I took care of it,
305,36:13,all today but like I hadn't done it in a while and so I was like oh man they're gonna get me for not paying my bills and,
306,36:19,stuff like that I better go answer the door so I answer the door and you guys know my Japanese is fine like I can get,
307,36:26,by and like like it's it's it's decent and I can have regular conversations with people,
308,36:32,however um this guy comes up to my door and uh,
309,36:38,starts explaining something about one of my like utilities and I thought to myself dang it I didn't pay the bill oh,
310,36:44,man and the way that it was explained to me in Japanese um made it sound like it was something that I had to get like something that I,
311,36:52,absolutely had to get and they're like why haven't you been answering our phone calls Etc and I did see that somebody had called me a couple times I was like,
312,36:58,God damn this is bad oh wait I think I know what you're talking about now yeah I don't want to give too many details,
313,37:04,about it but yeah you probably know what I'm talking about right so I'm like okay let me fill out all your stuff and dudes,
314,37:11,like it'll take just a moment and I'm like okay thank goodness I sit out there outside in the Blazing heat for 45,
315,37:16,minutes with this gentleman oh my gosh filling out things opening up QR codes writing down details Etc and the dude,
316,37:24,starts becoming increasingly nice to me like oh well your Japanese is so good it,
317,37:29,wow it sure is amazing is he a Salesman and then he he was like oh yes you have,
318,37:36,all the documents because he kept asking me for like official documents that I had and I was like this must be a real thing that I have to do and so I pulled,
319,37:43,out all the documents that I had saved and I was like here you go he's like oh wonderful you kept it very good and I,
320,37:48,was like um all right well what I mean this is a little suspicious but okay so I did it right I filled out all the [ __ ],
321,37:54,and then I messaged along the way I messaged um my cool neighbor lady the,
322,38:00,cicada throwing neighbor lady uh let's call her Midori job because she has green hair she has like dark green hair,
323,38:05,so we'll call her Midori sham I call Midori Chan or I texted her and I was like Hey Midori Chan,
324,38:11,um I'm a little worried because there's a guy out here and I think that this is something I have to do and I kind of,
325,38:17,understood what he said but I asked him a couple times is this something I need and he kept avoiding the question,
326,38:23,um and giving long complicated explanations so Midori Chan says here I'm coming over let me give him a call,
327,38:30,because dude dude gave me this number right so Midori Chan comes over and,
328,38:35,places a call and uh she sounds very cross,
329,38:41,and uh she hangs up and she's like,
330,38:46,this happens a lot like this is this is this is something that happens very,
331,38:52,often um nah they just basically convinced you to switch providers and I was like bro,
332,38:58,are you serious she's like don't worry I canceled it for you and I was like thanks Midori Chan,
333,39:05,she's such a Chad she always helps me she's like it's okay this happens very often and I don't think it was very nice,
334,39:12,of them to take advantage of the fact that you're Japanese it's like it's not perfect so you can't really understand the details they were firing off some,
335,39:19,really musakashi nihongo,
336,39:26,yeah yeah they don't they don't act that nice and and use Simple Japanese no they,
337,39:32,go hard like yeah that just reminds me of like that's why like whenever I see like salesperson people at the door I,
338,39:41,just don't answer it's smart I just don't answer um and if it's something really like like for example like oh I needed to pay,
339,39:47,for something or feel something like mandatory then they would usually leave something behind you know true you have,
340,39:54,a note or something and then I can just call them back or or do something about it but if not I just the moment I see,
341,40:01,someone with like a like you said like a clip yeah yeah with like a pet and stuff like that I'm,
342,40:08,just like nope I'm not answering that I should have known because in the past I've said that to salesmen and been like,
343,40:14,do I need to do this and then they'll like give an explanation that's long and I'll be like goodbye and like pretend,
344,40:19,that I don't speak Japanese but I guess he saw that I spoke enough that he was like all right I can I can do this but,
345,40:25,yeah it didn't turn out very well for me and I guess not for them either um,
346,40:31,single stay away from me Dottie Chan I need her to throw cicadas for me,
347,40:37,but it all turned out okay it turned out okay in the end and uh yeah I learned a lesson again so,
348,40:43,sales people is scary story like oh this was like ages the most intense,
349,40:51,um experience that Mama rat and I had to go to like make sure that like that we,
350,40:56,made the salesperson think that we weren't home because we also avoid you know answering the door if it's like a salesperson and normally like if they're,
351,41:03,normal they will like you know ring the doorbell knock maybe a couple times and then if no one answers they'll walk away but no we a couple years ago we had,
352,41:11,someone bang on the door like constantly and then like yell like because they saw,
353,41:17,there was a car in the driveway they started yelling things like we know you're you're home oh my God it's scary,
354,41:22,scary but they were they look like a salesperson because they had that like clipboard right so Mama red and I was,
355,41:29,quite young at the time and then she immediately was like Hey get on the floor and I was like what because we have like this window you can kind of,
356,41:37,see so like if you imagine the dull way and then there's like a giant window you can,
357,41:43,kind of see into the window if you like you know kind of like position yourself,
358,41:48,um at the doorway so she immediately said get on the floor and I was like what because the guy wasn't moving he,
359,41:55,was just standing there and he wasn't like leaving he was just standing there and then I got on the floor and then she,
360,42:00,started crawling towards me and I'm like [ __ ] it's like Movie experience oh my God,
361,42:12,whatever you do don't get up and I was like but I need to go to the kitchen to get water,
362,42:23,that reminds me of like like an hour the guy left but I was like hello,
363,42:29,you're desperate are you oh my god wow an hour that's long yeah it reminds me,
364,42:37,of like how you know how I said that I don't answer like I just I just don't answer if I feel like the person's,
365,42:42,suspicious or not it's really hard to do that though like you said when they kind of know that you're home because like,
366,42:48,like right before they run the oh I got kicked out wait no oh I get you back I,
367,42:55,get you back let me let me back in there I get you back in here uh oh I left too,
368,43:01,oh oh we all got kicked they didn't like iris's story it's fine I'm making a new,
369,43:07,one I didn't even start it didn't even start the premonition,
370,43:13,I don't think so no it's cool I'll get you guys back it's the same as before all the same stuff,
371,43:19,yeah there you are okay I'll just I'll just keep talking about it while I'm while I'm I'm invisible but um anyways,
372,43:26,yeah what was I talking about oh yeah so like I was I just happened to be like was binge watching some sort of anime or,
373,43:32,something so I was like I was listening to it on speakers too and you know how the walls are thin yeah so thin over,
374,43:39,back here in Virtual Japan so I'm pretty sure they could hear me watching like like,
375,43:49,through the door that's how they would ring the doorbell like at least five to ten times thinking I'd be but I'm just,
376,43:55,like nope I'm not gonna answer nope nope nope nope I just mute the anime right away and I turn off the lights and of,
377,44:01,course they know that I'm home but I just pretend like nope nope yeah here we go okay I'm gonna move,
378,44:08,oh yeah okay is Iris in here I'm coming,
379,44:13,hurry up I'm kidding I'm kidding there we go I'm here there she is there's hope hope is descended now I'm gonna arrange,
380,44:19,everyone again sorry for the slight weight you guys it's fine you can just listen to us and and believe it on your,
381,44:26,heart it's okay no no you guys you guys were saying that I wasn't on the screen,
382,44:31,but no actually I was camouflaging with him,
383,44:39,with the blanket right there he just went outside to you know,
384,44:46,get some sticks out of it yeah we're gathering firewood,
385,44:53,guys let us gather give us a second to gather the firewood okay okay we're,
386,44:58,gonna get some sticks yeah and like stick some rocks and another thing that I just I just,
387,45:04,remembered you know how you guys are talking about how sales people and a lot of times people who come to your door,
388,45:10,are also scammers yeah yeah cameras yeah and there's this one like my mom told me,
389,45:15,the story of that this this very um distinct scam sort of sort of scam uh,
390,45:22,thing that happens sometimes very rarely though but sometimes in Japan is when a very cute girl comes to your door with,
391,45:29,fruit like she would come with like a wagon of fruit and she'd be like could,
392,45:34,you please buy fruit why does the sun Snow White sound I don't know I think,
393,45:41,she would come with like she would come with like melons or or like a lot of fresh fruit be like these are just fresh they came fresh from the like they would,
394,45:48,buy it from some sort of supermarket close by and then they would sell it for like three times the price being like can you please buy the fruit I'm I'm in,
395,45:56,I need I need the money um please buy the fruit and it would be a pretty cute girl,
396,46:02,yeah and some people would be like oh you know sure it's hot outside and they don't want to a lot of times they would,
397,46:09,come like in the middle of like a rainstorm because they don't they want to make you feel bad basically like they,
398,46:14,they would come with like an umbrella like with a whole raincoat being like drenched and they're for fruit also,
399,46:20,being drenched in rain and they're pretty much really good please I I've been like going through so many,
400,46:26,different houses please please buy and they were you're like oh is she okay she's like in the middle of a storm and,
401,46:33,it's it's pretty it's pretty that's a big yeah yeah it is really a buy,
402,46:38,business when you think about it I'm sure there's a car nearby or something but they they would make a girl like,
403,46:44,look like she's alone outside with like with nothing just an umbrella and like,
404,46:49,being drenched in the rain yep does this happen in the cities suburbs are like where does this usually I don't know,
405,46:55,I've heard this happens like I mean you know in in pretty much this,
406,47:02,I've heard stories about this one like cities too not not only like suburbs yeah,
407,47:07,people are ruthless playing off the pity of human beings I mean yeah I mean we've,
408,47:14,been talking a lot about like bad experiences have you ever had like a really like good dolanaka experience,
409,47:20,um experience no not really I have oh yeah I've had just one it was very,
410,47:28,wholesome and I went to bed really happy that night um basically this was around the time,
411,47:34,where um you know the world kind of uh shut down and like right at the beginning of,
412,47:40,it and a lot of people were experiencing um like financial troubles obviously because you know people were losing,
413,47:45,their jobs Etc and stuff so one day I was home I think I was it was a weekend or something and I was,
414,47:52,just chilling with my morning coffee as I normally do and then someone knocks on the door I did not get on the ground because I,
415,47:59,saw it was just it was a lady um carrying like a big basket and I was like oh what was this and I opened the,
416,48:05,door and she was she looked it was a really nice lady and she had like a basket full of muffins that she had it,
417,48:11,was like I could feel the heat it was like freshly baked she was like hi would you be interested,
418,48:17,in purchasing some muffins um they're handmade um we've just been experiencing you know,
419,48:24,some some difficulties and we really appreciate if you could you know spare some um money and some support and I was,
420,48:32,like oh my God I'll take it all I didn't take it all but I bought like um I,
421,48:38,bought like three blueberry muffins and three chocolate muffins and big size muffins as well and then and she was,
422,48:44,like thank you so much and we really really appreciate it and then she left and then I had a blueberry muffin with,
423,48:49,my morning coffee and it was wow ah that sounds nice though because like if they actually cooked that's a different thing,
424,48:55,you know yeah no it was like yeah you can you know how you can tell if it's like a homemade muffin versus like,
425,49:01,wrapped in plastic bought from the store no even the shape of the muffin like you,
426,49:07,know how store-bought muffins are really perfect looking yeah they're too perfect they all look perfect identical yeah and,
427,49:13,then you can also tell because like in the blueberry muffin there was like real big blueberries inside and I was like oh,
428,49:20,my God like it's not just blueberry jam oh that's so happy blueberry muffin now from a suite,
429,49:27,did any of you guys do um did any of you guys do Girl Scout [ __ ] back in the day oh I didn't do Girl Scout but my school,
430,49:34,had this fundraiser thing where they had us so candy yeah candy bars a whole box,
431,49:42,it's like a whole box worth of like a hundred dollars worth of candy bars they could go sell them and it's just like oh,
432,49:47,my God that was that was one of them I hated that I hated that having to go,
433,49:52,door to door be like please buy candy and they would have to pity by so yeah I mean the Girl Scout thing does seem like,
434,49:59,a penny buy thing I was actually the only girl that wasn't in Girl Scouts in my small group like in my my small class,
435,50:05,because uh we didn't have enough money and I was the only one out of like,
436,50:11,something like 25 girls um this was when I was very young very young so everyone else was like,
437,50:17,competing for like the cookie sales and stuff like that and at first I was like oh I'm sad I can't be in Girl Scouts but,
438,50:23,then I heard them talk about all the cookie sales and how hard it was to spend their weekends going like across the neighborhoods like trying to sell,
439,50:30,cookies and I thought I don't give a [ __ ] anymore [ __ ] Girl Scouts sir I was dying when,
440,50:35,Iris said the selling chocolates thing because my entire rat School Korea I,
441,50:41,think we did that chocolate thing maybe like four five years and every single,
442,50:47,year I would sell the entire books but I personally only sold one bar,
443,50:52,I will always give the books,
444,51:00,that is cheating that is cheating I've only sold one chocolate blindness to my,
445,51:06,neighbor and it took me half an hour oh my God yeah literally me like the,
446,51:13,first few doors are just it's just your heart is thumping so loud and you're just like oh my God they're gonna be,
447,51:19,scary but yeah like I basically went I was like living in a condominium back,
448,51:25,then so I just went through every single floor um knocking on doors and I think I was,
449,51:30,able to sell pretty much the whole box uh I think I bought a few myself too to,
450,51:36,make up for some but yeah like uh I only had to do that once so thankfully,
451,51:41,thankfully yeah it was a horrible experience and you feel you feel horrible when they say no yeah I don't,
452,51:47,know what that is the steel you need to have nerves to steal being a Salesman you reminded me of another sweet memory,
453,51:53,though that I had back when I was visiting uh Papa Reaper I hung out with some of the kids in the cold the,
454,51:59,cul-de-sac and um we were just playing like we just play like make-believe games and stuff like that and then we,
455,52:04,got this harebrained scheme idea to go pick up pine cones and pine branches and,
456,52:10,sell them to the people that lived in the cul-de-sac so we would go knock on,
457,52:15,people's doors [ __ ] we found on the ground man just,
458,52:21,outside their houses and everyone said no except for like one,
459,52:29,one guy like a teenage kid gave us like 25 cents,
460,52:34,my favorite was the 45 year old dude with like a beer belly and like kids in the house who came out and was like what,
461,52:41,are you kids doing and we're like would you like to buy a pine cone sir and he said he said nah I'm good,
462,52:48,um you all need to put that stuff back in the yard and then close the door,
463,52:55,we did our best though,
464,53:01,but that kid that gave us a quarter definitely took the branch in his house and put it right in the trash can,
465,53:07,yeah at least he gave me something out of it that's nice yeah that was a sweet guy oh,
466,53:14,man how to be young and stupid but full of hopes and dreams,
467,53:19,that just reminds me of how like um you know trick-or-treating yeah oh my,
468,53:25,God maybe you should talk about this during all like October but like um you know like how um sometimes you,
469,53:31,would go trick-or-treating in the neighborhood and sometimes they don't still can't they don't have candy so you know what they would give us instead money,
470,53:41,here you go they give us like 50 cents or like a dollar instead and be like okay that's fine too,
471,53:49,I've never gone trick-or-treating to begin with but what that's crazy I love it I don't know,
472,53:55,sometimes sometimes they would like oh we don't have candy so we'll just give you some some coins,
473,54:01,a little change jar crazy what yeah that's some change yeah I got some change here you go sort of kind of smart,
474,54:07,to be honest you probably spend less money just giving them coins than going out buying a ton of candy bars to give,
475,54:13,to kids that's pretty that's true I think yeah [Music] oh Halloween I'm excited I'm gonna we,
476,54:22,need to set up a special Halloween shag cast episode yeah we can all wear different costumes yeah that'll be,
477,54:30,something that sounds nice yeah I want to be a cowboy oh yeah I want to be a mummy ooh,
478,54:39,what about you baby I want to be wrapped in toilet paper oh you're great to survive the porta potties,
479,54:47,no no no I didn't mean to connect the story no that's how I see it,
480,54:53,I'll just be a ghost the the kid that has a blanket over them and they call it a gun,
481,54:59,I love that and I'll just have my ears just poking through like the blanket is fine what,
482,55:07,would be the tenth episode the 10th episode anniversary could be a Halloween special,
483,55:13,yep we sure are on Halloween baby Halloween,
484,55:19,let's go God even the the non-spicy one I had like another you know I bought two,
485,55:25,of those the the what do you call the carbonara ones yeah the second one I literally only use like two or three,
486,55:31,drops of the spicy and it was perfect wow it's so good it's really nice so,
487,55:37,[Music] um sorry guys if I'm quiet I'm away from the mic because I don't want to crunch,
488,55:43,too loud yeah it's all good I have you on 200,
489,55:48,percent I always have Beyond 200 too yeah cause,
490,55:53,she's got a little mousy voice no it's a little tiny little red boy it's a squeaky squeak,
491,55:59,I don't know what it is what it is sometimes on streams I sound fine but then on some other people's trips I sound really quiet I don't know what it is czar,
492,56:07,I don't know aroma my s'mores are gone I'm sad I don't know,
493,56:13,what to do now I was enjoying my my Rua bus tea my chai ruabus,
494,56:19,now I need to go heat up some more water but with our tea kettle that we brought with us to the camp,
495,56:25,yeah definitely I'm gonna do that let me leave my body for a second don't talk [ __ ] please please don't talk [ __ ] about,
496,56:31,me hold on I'll be right back I'm leaving to get get up some water,
497,56:36,let's talk shitake about her um,
498,56:51,poopy very poopy oh look at her face look at,
499,56:57,her her little frowny face is literally like a poopy face right now,
500,57:04,[Music] and I bet I bet you know we're all we're,
501,57:10,all hundled in these blankets but I bet we're sweating under these blankets right now because there's a campfire,
502,57:16,right nearby I must and it's summer so honestly it's not that cold outside so oh my God imagine oh no,
503,57:31,breaking back to the conversation I was just thinking oh my God the sweat,
