no,timeline,subtittle,text,H-RVkfXWL4s
1,4:03,howdy girl what's up,
2,4:10,sorry to try to chime in with a little one what's up hi guys,
3,4:19,are you guys camping today,
4,4:24,you guys better be in a real Forest by the way I need you all in a real forest,
5,4:30,or else you're not allowed to be in the the stream yes I'm I'm calling in from,
6,4:35,outside in my backyard um yeah I'm camping you guys I'm I'm,
7,4:41,having mosquitoes bite bite me left and right every minute oh ow yeah it really enhances the,
8,4:49,experience I'm gonna kill I'm gonna kill that that,
9,4:56,that that mosquito rat fly whatever that's flying around me just smack it,
10,5:01,away shall we you'll get him eventually you'll get him eventually you guys like,
11,5:07,the little fire we had built out there yes it's a bit far away so I'm a bit chilly,
12,5:15,that's fine that's fine we've done each other we're inside the tent we're fine that is true that is true and we've got,
13,5:22,our little blankets yeah which means that we might cause a fire hazard because we're leaving the,
14,5:27,fire unattended that is usually yeah fine yeah how are you guys doing welcome,
15,5:34,back to another episode of chat doing not bad actually um we're supposed to kind of do this a,
16,5:39,bit earlier but schedule things didn't really like work out too much so we ended up moving it to tonight the night,
17,5:45,of nights where we didn't really have much going on and it worked out for the better I think because I was looking,
18,5:51,forward to this all day today was one of the weirdest days of my life,
19,5:58,it's like I go out of my house for like one second and then it's like I Doom myself to run into like a million weird,
20,6:04,things and I say a million but there was really only two that kind of like freaked me out a little bit are you,
21,6:10,chomping on something bae you want to tell people what you're chomping on first we we prepared in celebration of um Chad,
22,6:18,Camp we've prepared some camp food um you know to really I mean I am in the,
23,6:23,backyard and you know definitely there's bugs everywhere I'm in nature but you know to really have that camp spirit I,
24,6:30,have some food a maid very lazy nachos,
25,6:35,um and it's really good is there such a thing as non-lazy nachos no I'm not I'm like actual nachos nachos right,
26,6:42,that you like order from restaurants and stuff and then you have my nachos that I put in the microwave okay I think it's a,
27,6:48,bit different oh you're making me really want to talk around five minutes taco rice is delicious,
28,6:54,you don't know what taco rice is no you he then um taco rice is uh it's Taco with,
29,7:03,rice basically you take the ingredients of a taco you dump it on top of rice isn't,
30,7:09,that just the burrito bowl no it's a little different because it's white rice it's called taco rice,
31,7:16,hold on a second wait I thought the ingredients of tacos and burritos pretty much the same,
32,7:24,kind of I feel like there's more rice in the actual um like the actual taco rice,
33,7:30,you crack like an egg over it sometimes and like you can eat it with chips my,
34,7:35,favorite has kind of a lot of vegetables in it too in my image okay that's what we call it okay that's a burrito bowl to,
35,7:42,me I see I see yeah I thought taco rice was a Japanese thing but maybe it's not,
36,7:48,like it is because I think it kind of is,
37,7:58,I see I see ladies have for Chad Kim s'mores,
38,8:04,so I went that was one of the reasons why I left my house today so I could get materials to make s'mores but you know,
39,8:10,it's Japan so it's impossible to find things to make s'mores especially especially if it's uh Natsu I meant to,
40,8:18,say summer oh my God if it sucks in such a in such a Gaijin accent to Natsu,
41,8:24,um he's trying to say nuts idiot no um I mean summertime because in summertime,
42,8:30,it's harder to find marshmallows but you guys I waited to tell I waited to tell you this on stream I found not only,
43,8:37,regular mushrooms but I also found mushrooms um oh marshmallows,
44,8:45,no it's mushrooms what I don't know why mushrooms I'm thinking about the mushrooms are delicious but they are,
45,8:52,really good I am a big fan marshmallows not only regular marshmallows but I also found don't don't you laugh at me I also,
46,9:00,found uh dajirling tea marshmallow is that how you pronounce it,
47,9:05,I have no clue what the jewelry I don't know in Japanese they pronounce,
48,9:12,it but I don't know Darjeeling I thought it was Darjeeling,
49,9:17,no don't trust me don't trust me I don't know what I don't know what what they're what it's called how it's pronounced,
50,9:24,yes and I also found coffee marshmallows too for Bae I thought you might be,
51,9:30,interested in that bay coffee marshmallows yeah I don't think I've ever seen coffee marshmallows,
52,9:36,before what the heck yeah I haven't either I'm about to try them,
53,9:41,let's go microwave and I couldn't find anything,
54,9:47,[Laughter] what do you say oh no no microwave,
55,9:54,s'mores is we have a fire right back there but I don't want to roast them instead I want to use the mini microwave that I brought,
56,10:01,using the power of newbie Rays um uh I am eating country mom because I,
57,10:08,couldn't find anything that was close to camper and like did in the convenience store nearby um but I have a chocolate country mom,
58,10:15,cookies which is very uh kind of catfish uh I also have chocolate covered chips,
59,10:20,that if you put it close to the fire the chocolate would become really droopy and,
60,10:26,yes like melted chocolate which I haven't opened yet but I will eat Iris,
61,10:32,don't tell me that they didn't have trail mix I think you just didn't want to eat trail mix,
62,10:38,no no I didn't see any trail mix nearby nope nope nope I don't see anything like,
63,10:44,that is that a fib or no I I really didn't I didn't trail mix,
64,10:50,didn't didn't really come up in my brain what else oh Cornell is walking around the,
65,10:55,convenience store now I guess that's true some people don't really think about trail mix when it comes to like stuff to take on like a hike and stuff,
66,11:02,like that but I always used to think about trail mix like awesome raisins chocolate chips and nuts [Music],
67,11:09,yeah I was gonna say the first time and only time I ever went hiking slash camping in my brain I was like oh my God,
68,11:16,I'm gonna be so cool with my trail mix and then I made it and then I didn't eat it and then I came back and then I still,
69,11:22,didn't eat it no ladies well I can't totally fall it's kind of,
70,11:29,nasty I've only had trail mix one time when we had to like um,
71,11:36,have like this we had this thing this Pro what do you call this it was like a,
72,11:41,out camping out sort of thing where we were supposed to like it was kind of like community service where we're,
73,11:46,supposed to pretend that like oh this is how people feel when when they don't,
74,11:52,have that much food oh I see I see yeah yeah and then like basically feel how it,
75,11:59,is it was something I had to do in school and like um basically like we had,
76,12:06,oatmeal for breakfast that was the first time I had oatmeal before and,
77,12:12,um I hated it it feels good it's yummy if you get the,
78,12:17,sugary strawberry ones the Quaker Oats mm-hmm yeah wow I'm sorry to hear that I,
79,12:24,mean to be to be fair though yeah things with oats aren't really the most tasty I talk all this hype about trail mix but,
80,12:31,you know you really just pick out the raisins and the chocolate and eat those and throw the nuts,
81,12:36,yeah the nut Snickers and I go to trail mix as well,
82,12:42,oh gosh it's like mine is pretty much it's pretty much oatmeal right yeah,
83,12:48,isn't it with like raisins and chocolate it's a mix of things yeah nuts like almonds and uh,
84,12:55,peanuts and whatever you want really you can kind of like mix it up and like make it like customize it and stuff like that,
85,13:01,so oh I see I see yep but uh I'm gonna,
86,13:06,eat another s'more real quick because these are so delicious they like explode in the microwave so,
87,13:12,quick though like you can only microwave them for five seconds before like they start to blow up real bit oh my God it's,
88,13:17,stuck to my fingers okay ah this is bad ah um oh no okay um hold on we were just we,
89,13:24,were talking um before the stream was started before the stream started because Iris was like I couldn't find,
90,13:29,any canned food and I was like bruh just just get some Ramen Ramen is cup of,
91,13:35,noodles is cat food it's true but then a lot of people don't like I guess you don't automatically think of like,
92,13:41,instant noodles as a cat food and then I called it instant noodles is Smart Camp food if you're on a spot you'll bring,
93,13:48,like cup noodles to Camp it is true though I feel like cup noodles is definitely a Cancun especially in Japan,
94,13:53,because it's just so easy you just put hot water in it and it's done yeah and you get a whole meal,
95,13:59,and it's high in calories so you know so you don't have to worry about not,
96,14:05,having enough calories to live out the day that was literally a YouTube account too I'm pretty sure yep oh yeah I,
97,14:12,remember that I feel like Japanese camping is like so much different than people's perception of like American,
98,14:18,camping like I've been on quite a few at least with like students I've been on a couple student camping trips and I've,
99,14:25,only been to cab once at school too that was like fifth grade yeah it's like a school thing yeah I mean,
100,14:32,it was interesting because like the projects were usually like make a curry together and who can make which group,
101,14:38,can make the best curry rice or like which group can like do a good barbecue or something like that we'd have like um,
102,14:43,like a Japanese style barbecue yeah so like a lot of campsites will have just,
103,14:49,like barbecue grills set up um for like Yakiniku style like Japanese style barbecue so like not like the hot,
104,14:56,dogs and like cheeseburgers you guys are imagining but like slices of meat like Yakiniku style uh vegetables mushrooms,
105,15:03,greens and stuff like that it's really awesome very delicious oh my God yeah we would make curry together as well in,
106,15:09,groups and stuff like that mm-hmm I remember um for breakfast they would split us up,
107,15:15,into like groups of like three people per and they would tell us to make our own breakfast and they told us to bring,
108,15:21,eggs and bacon and the person who was in charge of bacon in my group brought turkey bacon instead and it was it was,
109,15:28,like we're like this is regular Bakery we started cooking it looks it looked and tasted so different from everyone,
110,15:34,else I was like what the hell's wrong with this bacon it was a turkey it was disgusting,
111,15:39,I don't like it all right I didn't like it that's fine that's fine you didn't like how dare you like something I don't,
112,15:45,like Iris I should strangle you right now I can understand that it's like if,
113,15:50,you're expecting normal bacon and then you get turkey bacon yeah just like it and then I was just like,
114,15:56,it's okay I'm just gonna wait for dinner because dinner is gonna be great but then no dinner ended up being chilly and,
115,16:01,I didn't like chili wait what actually is good Iris I'm gonna kill her I'm kidding I don't,
116,16:09,like the bean I don't like the beans and the chili no you can pick them out like,
117,16:14,yeah I just took them out pretty much pretty much I pick up,
118,16:19,I forgot I make it into meat sauce instead without the without the beans,
119,16:25,I see man you're making me want to order like taco rice and like chili and like like little chips like tortilla chips to,
120,16:32,dips tomorrow's dinner tomorrow's dinner oh but you know like one good thing,
121,16:38,about um oh sorry this might not be something I should talk about while you guys are eating oh oh let me eat my last s'more,
122,16:45,really quick hold on I got I got this oh my God,
123,16:50,three they're little huh well you guys are gonna be hearing crunching throughout,
124,16:56,the entire two hours oh well are you a slow eater like Iris,
125,17:03,no I'm a very fast eater but hey where are you flying shots at me,
126,17:08,I got a bone to pick with you not a turkey bacon at dinner in 10 minutes today,
127,17:16,but I'm trying to balance eating and also talking and also listening you're very difficult [Music],
128,17:23,um but what were we talking about oh yeah yeah Iris I have finished my mouthful you may now speak yes okay is,
129,17:29,it okay yeah go for it um okay so um the fact that I wasn't able to eat much during Camp wasn't really that wasn't,
130,17:36,wasn't actually a bad thing because the only bathrooms that they had at Camp were the portable ones and you guys know,
131,17:42,how the portable bathrooms are right and that was the first time in my life I had to use a portable bathroom and so,
132,17:49,basically I didn't want to use it and I think the first person who would use it would have a pleasant time because,
133,17:55,you're the first person to use it right but um afterwards it just you know it piles up so,
134,18:01,um basically basically what I did was I held in,
135,18:06,everything,
136,18:12,it was it was a it was a one night a two-day uh camping trip so,
137,18:18,um I held it and and then at the very last like hour so right before we went,
138,18:23,to uh went back to the school bus I had to I had I had to I not not not not not,
139,18:30,like it was just um just I had to do an idol meeting,
140,18:35,um but anyways that's [ __ ] money,
141,18:41,and it was so bad like it was like it I never I never want to use I know no no,
142,18:48,no and not number two guys no no no no no no no some people in chat were like number two no thankfully I didn't eat,
143,18:54,that much so yeah yeah I think okay I thought you yeah I was about to say like,
144,19:00,are you are you literally telling your fans about the time you had explosive diarrhea,
145,19:06,bro like I said I didn't eat much so so,
146,19:14,literally nothing nothing nothing so no number two but but I couldn't hold in,
147,19:20,everything else so basically yeah it smells it was so the smell was,
148,19:27,horrible and ever since then I decided never to play at a park for too long because they have those at parks too or,
149,19:34,never to go a place that doesn't have a bathroom and I hate and that basically um cut in stone the fact that I don't,
150,19:41,really like camping I mean imagine uh imagine how the drivers of the honey wagons feel do you know what a Honey,
151,19:47,Wagon is no I don't what what's a Honey Wagon uh a Honey Wagon is basically,
152,19:53,um like the the Honey Wagon truck is the truck that exists to uh basically take,
153,19:58,care of everything that the portable toilets uh procure inside of them so,
154,20:03,like especially if you're like on the set of a film or something like that and go hey there's the Honey Wagon driving,
155,20:08,by it's the truck and it's a truck filled with [ __ ] from the port of from the portable toilets because it's got,
156,20:15,well the contents I'm anyway so yeah yeah that's yeah it's the Honey Wagon,
157,20:20,I've never had so much difficulty swallowing food before [Applause] [Laughter],
158,20:29,I I restarted it I restarted it what no no no I kind of did I kind of did but I,
159,20:36,mean uh back to camping experience I've only been like camping camping in tents,
160,20:42,like once um and it was also a hike so it wasn't any fun activities it was literally just,
161,20:47,hike and Camp I think it's tiring though yeah oh I it,
162,20:54,was the first time I've ever went it was the last time I ever went it was like it was so sad um it was like imagine baby baby rat,
163,21:01,carrying like a 13 kilogram bag um hiking,
164,21:06,goodbye yeah distinctly like towards the end because it was like a two-day hike,
165,21:13,um towards the end we were climbing up something it was kind of steep and I could feel the force of gravity and I,
166,21:20,nearly fell backwards um thankfully there was someone behind me who just pushed me and I was like you,
167,21:26,have saved my life thank you so much oh what a Chad yeah that was very kind of,
168,21:31,them yeah but like speaking of like the the the the the bathroom incident,
169,21:38,um I remember I strategically woke up at,
170,21:45,like four in the morning to go to the bathroom so I'd be the first one to use it but I just realized that all my friends were,
171,21:52,all so smart because like at 4am you could just see like groups of people just going to the bathroom trying to be,
172,21:58,the first one to go but it would just be useless and we all just got it before in,
173,22:04,the morning anyway it was sad it's a little bit I mean,
174,22:10,yeah if you want to go to a quality camp they don't have portable toilets they,
175,22:15,have they should have their own plumbing system you know but those cost money for people,
176,22:23,where'd you guys go [Music] you guys are talking and I can't hear you,
177,22:29,where'd they go they left me I can't oh I know why,
178,22:38,I left them back oh she's back oh she actually left,
179,22:45,okay that was very strange no no my sorry my manager asked me to join into,
180,22:50,like a really important group that like it like popped up and I like joined it and I was like okay and then I went in,
181,22:56,there and then I was like where'd everyone go because I didn't know it was gonna take me and throw me into the voice Channel anyway anyway hi no,
182,23:05,problem I'm back um she came back with milk yeah oh that,
183,23:10,was very nicely tied we thought that was I thought we thought you ran away from the toilet oh I mean that too I guess I,
184,23:18,I took all of the viewers with me I pulled them away from your nightmares,
185,23:24,oh God it's okay everything's fine um but yeah Camp is I don't know there's,
186,23:31,like the whole setting up the tent thing is also I was the useless one in the team when,
187,23:36,when making the tent like they were they would have the poles and the and the yeah the the cloth part they'd be like,
188,23:43,oh put it together like this and I'm like I don't know what to do so I would have my other friends help pretty much,
189,23:49,build it for me and I was just like I don't know they were just like okay I was just hold on to this just hold on to,
190,23:54,this that would be this I would just be yeah just hold on to it don't do anything just hold on to it because I,
191,24:00,don't know how to do anything yep man that's interesting I just I was the one who was like hammering the the pegs into,
192,24:06,the ground nice well all right girl body strength,
193,24:14,man that's so adorable I feel like I've been camping a ton of times actually but I've never camped in a tent before it's,
194,24:21,always been cabins I wish I had it I wish I camped in the,
195,24:27,cabin yeah they're pretty cool yeah yeah I think like I have been on with cabins,
196,24:33,are really fun though I'm pretty sure the camp place that I've been to had cabins too but they were for like the,
197,24:41,upper grade schoolers like we were like the fifth grade the little kids so we had the tents meanwhile like the 8th,
198,24:48,graders got the cabins but yeah it just reminds me it's like even we got the,
199,24:53,cabins it's literally just a room with like bunk beds and then we would walk past where like um where the where the,
200,24:58,where the teachers would stay and it's like a fully decked out like that ain't,
201,25:04,right no room and we're like what you guys get a TV in the freaking Kettle and we have,
202,25:10,mattress that's it just mattress,
203,25:16,I've never slept on a bunk bed before that sounds so cool no it's not that,
204,25:22,good yeah of course we would ask for the top right yeah what if the what if it,
205,25:27,you know it breaks down and breaks and you die yeah that's why you would always stay at the top so you're not the one,
206,25:35,um unless the ceiling is low then the top buns suck oh yeah yeah that's true hit,
207,25:42,your head every single time yeah most cabins are usually not that high anyway like the ceiling so top bugs suck bottom,
208,25:51,bug suck everything just sucked yeah bunk beds are not the best I remember when I went camping a long time ago,
209,25:57,everything about it was bad because uh basically my school went on a camping trip and I loved the camp that we went,
210,26:03,to so much that I begged I begged Mama Mori um to get me and little sister reap to,
211,26:08,go to the camp like officially you know like um for the summer instead of during the school year and so we went to this,
212,26:15,camp and it was it was Insanity um I actually I recall that I went um,
213,26:22,when I when I went I felt so alone because I distinctly remember being in the middle bunk in the middle of the,
214,26:28,cabin and I recall that I had like I had like a bunch of like manga with me like,
215,26:34,Oren High School Host Club and like girls the point be like what's,
216,26:40,that I'd be like manga they'd be like I don't know what that is I'm like it's Japanese comics and they'd be like okay and they like wouldn't talk to me,
217,26:49,so it's fall in love [Music],
218,26:54,so I just kind of I kind of rolled with it but to be honest I actually only was at the camp for um for two days uh the,
219,27:02,first day that I was there um we all played this huge like game and somebody accidentally hit a huge swarm,
220,27:09,of killer bees and they came out and stung about 30 kids including me on the,
221,27:14,finger but some kids got stung on the face which was bad um and I was fine I took it like a champ because it was just,
222,27:20,my finger I was like holy [ __ ] that really hurt and then I went to go to the the medical area the the med cabin and,
223,27:27,there was just a line of like 20 kids and I was like jeez oh my God holy moly,
224,27:33,the counselor snuffed him out though eventually that was the first night the second night I got appendicitis and had,
225,27:39,to leave so that was my Camp story oh my goodness that reminded me so like,
226,27:47,I I said that I only had one Camp experience in my life right but I was,
227,27:52,supposed to have technically two Camp experiences but the second one got canceled because it was my sixth grade,
228,28:00,um camp and basically what happened was that um right before we like we were,
229,28:05,going on the school bus to go to the campsite someone mentioned that they lost their wallet and then automatically,
230,28:12,for some reason the teachers thought that someone stole that person's wallet and so came the came the whole oh eggs,
231,28:20,yes um pretty much someone we have to find,
232,28:26,out who stole Blah's wallet otherwise we're not getting on the school bus like,
233,28:32,everyone is not gonna go to Camp unless someone speaks up so if one person's fault,
234,28:37,ruins everyone's experience and I don't even know what happened to that in the,
235,28:44,end I don't know what happened to that in the end someone even actually stole a wall to,
236,28:51,begin with I don't know but because of that we couldn't go to Camp yeah oh man,
237,29:00,what do you call that like you know when when it's just one person's fault but it they decide to punish everyone all right,
238,29:07,I don't know is there a word for that in Japanese there's a word called,
239,29:13,yeah I don't think there's a word in English for that oh yeah but yeah,
240,29:18,I'm gonna write that down I want to use it someday punishment I guess yeah Collective punishment,
241,29:26,that sounds so so scary in English,
242,29:33,Among Us stop saying Among Us I know oh my God that really we were all,
243,29:40,so bummed out and like we were like with our backpacks and with our camping bags,
244,29:46,and everything in Reading you're like school like that no I know it's not and,
245,29:53,everyone's like just was so upset and and then yeah that was my last,
246,29:59,ever um almost Camp almost Camp experience,
247,30:06,oh and that was the year that we were able to use the cabins too but no no,
248,30:16,I'm thinking about like cabin camping is like if your tools you know the first,
249,30:21,night you get there you're probably really tired you just like sleep on the bunk bed mattress and whatever but I remember my friends and I after the,
250,30:28,first night we just pull all the mattresses off the bunk beds and just lie them in the middle of the room and,
251,30:33,we'll just have like a giant like slumber party type situation and we all bring we had all brought snacks and,
252,30:39,stuff like that's the true essence of camp but and like you would like you know talk and like you know stuff all,
253,30:45,night because because it cabins it's kind of soundproof I mean everyone else was doing it as well so like you can't sound proof sound because they're just,
254,30:51,so much sound and the teachers are always on like the other side of Camp because they're in their freaking Motel looking ass rooms right yeah,
255,30:58,that one time we had 10 to Camp tent camping is very different because there is no soundproof at all and because it,
256,31:06,was a hike everyone was so tired but there was one one group one group who decided no we're,
257,31:13,gonna stay up all night and we're gonna talk we're gonna talk [ __ ] about everybody and forget that everyone else can hear us in the middle of the night,
258,31:20,Hooligans fool again tenth camping is that we're all together even the teachers right so,
